{
  "schema": "postfiat-validator-evidence-qwen-replay-foundation-exit-criteria-authorization-gate-v1",
  "gate_id": "validator-evidence-qwen-replay-foundation-exit-criteria-authorization-gate-2026-05-24-example",
  "mode": "design_fixture_only",
  "qwen_replay_foundation_exit_criteria_document_gate_hash": "5f856a279a0f72a698fee07252448defc15592908cb7c0603bda3a324e0bcd4442c07a579f49aba7d786dcb2da832d2e",
  "qwen_replay_foundation_exit_criteria_gate_hash": "97eaa98ff9d53d43f339d8df1b16043b16c6ecfdc1f545b6588f8b25a47a76517e13c22932e4081718d8d7d9c410c7e3",
  "qwen_replay_authority_transfer_decision_gate_hash": "b1389c357c339cb39cbbbeea4a143302da619dce72e7dfcb62eee7607a3685b1b0d4776ee62b1e85d7399db0cff74399",
  "qwen_replay_registry_mutation_decision_gate_hash": "dcdc5989da2ec6537ecc00a1e14521cef8ac137a54f284296c5363d9dfeba9cc93e118a4b17172dd2d794dd27fcb1dc3",
  "qwen_replay_cobalt_submission_decision_gate_hash": "9fb98620bc6b5efeffbdd7d97c9ccb91994f0abeb6f546604b46158ae806f01262e08b6d36ac274f6b0f5e96e71daeb5",
  "qwen_replay_governance_queue_decision_gate_hash": "43ca460feb412ff6a90b5f6438dae7e872df81fd442607de33ff994ffc6cb38efe4b2d8573d678829ebf6e4fd8acc96b",
  "qwen_replay_governance_queue_gate_hash": "5643d8e93a6db3d3992da4ea28d7c77c5e141d0a535046d2f6d44537258f593329d432e44c50f00e8ab7aa55f82939ad",
  "qwen_replay_release_decision_gate_hash": "97902b0971ee4e1c4781c1e3fbe3bbdbcfdfbd6eaa80294cc0863a8f8e98d3e809a8185ab2a1c4172038b21d9c6d2469",
  "qwen_replay_operator_review_gate_hash": "ca16673f84d83960e26384720686f8da361d4a936c11b1bb6932d56fd16c7867591a0e80c0544924e82e5dfd7c6c7bba",
  "qwen_replay_release_candidate_gate_hash": "6d436bce0b3a6ba55af5bc97e072e90406d11502129350fe22ce615aab0431badffc355fd82db2a1a32a55ba6dbfa050",
  "qwen_replay_promotion_decision_hash": "0ab4dac359306abc928842337d22eab5846a0eb8a2f53ae0384d16f372200c0ae60b0979184927c7a7545d55147b1b97",
  "qwen_replay_output_validation_receipt_hash": "8f8bfb3f08972465b8fb0b662cdbb588d845992b1edec2b8d70004d3ddf8a67b5d2d702549672b928a12edef394d9481",
  "qwen_replay_output_manifest_hash": "5827198eec42adba9787acd3de26a42f01dd00c302b0b6439850ec31bee7dbb41556a443b8ead91b6fb4eb6f882130c3",
  "qwen_replay_authorization_hash": "1f042d1a29ed6f3fa9a993a8e75a62e392fef11feaea838eb63f4116bf55b8ca0362bab0d4b0f878e2492fb44eaacd37",
  "qwen_replay_preflight_hash": "a9bfa93538b64baa57175631bf474d7df68726bcf5ed97265a6b0bb453384b68339f150f4fe88d1b47962406af1fe4d3",
  "qwen_prompt_redaction_audit_hash": "8a8f8dba3c0a39976774c3d7d3d22ca870416c0439a66320aa7517089d08fed8f93080ffe2f9ef3faa10668a5f80591c",
  "qwen_prompt_input_manifest_hash": "3fbef662f11c1eb0a5ebe6fb1e179f1442595a432c8be2dcc0e330c064835ad0e6a7a6506bc38773127a71a2fac30310",
  "qwen_public_summary_projection_hash": "0655f52f349f25be91688730073dec47737647efe9a4c07c020dd347ae8fa450476c1a4fe1d20efa440dbeaabe64f347",
  "model_request_hash": "16e0536cdaf31cac4400dbbe0d8cda5a8c5b06cfdf59c1a399277658ca50af1f1d586898703148491b8e4e2a040d1a5b",
  "packet_schema_hash": "92544968ea283754c5cd3cfba85194afff80f9366f07063b5cd228ea58a6f9efbeb74ad416f9f118595f8c6719d4f0c3",
  "field_registry_hash": "a4d0ad75fcf706432e2d44bfd75486139a69116249ffb47bbc786fcb67ab939b25f99834d5cb5aa7bb93cfed8901200f",
  "collection_window": {
    "from_height": 1000,
    "to_height": 2000,
    "from_time": "2026-05-23T00:00:00Z",
    "to_time": "2026-05-23T06:00:00Z"
  },
  "foundation_exit_criteria_authorization_gate": {
    "authority_transfer_decision_status": "not_requested",
    "authority_transfer_authorized": false,
    "foundation_authority_retained": true,
    "foundation_exit_criteria_status": "not_defined",
    "foundation_exit_criteria_satisfied": false,
    "foundation_exit_criteria_document_status": "not_authored",
    "foundation_exit_criteria_document_complete": false,
    "foundation_exit_criteria_document_hash": null,
    "foundation_exit_criteria_authorization_status": "not_requested",
    "foundation_exit_criteria_authorization_complete": false,
    "foundation_exit_criteria_authorization_hash": null,
    "foundation_exit_criteria_authorization_scope_hash": null,
    "authorized_authoring_principal_hash": null,
    "authorized_review_path_hash": null,
    "authorized_cobalt_ratification_path_hash": null,
    "foundation_exit_criteria_review_hash": null,
    "foundation_exit_criteria_cobalt_ratification_hash": null,
    "foundation_exit_criteria_satisfaction_receipt_hash": null,
    "criteria_item_count": 0,
    "authoring_lane_opened": false,
    "future_foundation_exit_criteria_document_gate_required": true,
    "future_explicit_authoring_lane_required": true,
    "future_operator_signoff_required": true,
    "future_cobalt_ratification_required": true,
    "future_rollback_plan_required": true
  },
  "required_future_inputs": {
    "foundation_exit_criteria_document_gate_required": true,
    "foundation_exit_criteria_authorization_request_required": true,
    "foundation_exit_criteria_authorization_receipt_required": true,
    "foundation_exit_criteria_authoring_scope_required": true,
    "criteria_authoring_principal_required": true,
    "foundation_exit_criteria_document_required": true,
    "foundation_exit_criteria_review_required": true,
    "foundation_exit_criteria_cobalt_ratification_required": true,
    "foundation_exit_criteria_satisfaction_receipt_required": true,
    "shadow_verification_convergence_report_required": true,
    "operator_signoff_required": true,
    "rollback_plan_required": true,
    "authority_transfer_plan_required": true
  },
  "execution_boundary": {
    "provider_spend_executed": false,
    "provider_resource_created": false,
    "provider_resource_destroyed": false,
    "live_model_request_executed": false,
    "model_output_generated": false,
    "live_network_access": false,
    "live_registry_mutation": false,
    "cobalt_amendment_submitted": false,
    "foundation_exit_criteria_authorization_granted": false,
    "foundation_exit_criteria_document_accepted": false,
    "foundation_exit_criteria_satisfied": false,
    "sidecar_activation": false,
    "commit_reveal_activation": false,
    "validator_enforced_scoring": false,
    "tp1_admission": false,
    "authority_transfer": false
  },
  "failure_policy": {
    "authorization_without_document_gate": "reject_future_authorization",
    "authorization_without_authoring_scope": "reject_future_authorization",
    "criteria_document_without_authorization": "reject_future_criteria_document",
    "authority_transfer_without_authorization": "reject_future_authority_transfer",
    "fallback_decision": "no_op"
  },
  "checks": {
    "qwen_replay_foundation_exit_criteria_document_gate_hash_bound": true,
    "qwen_replay_foundation_exit_criteria_gate_hash_bound": true,
    "qwen_replay_authority_transfer_decision_gate_hash_bound": true,
    "qwen_replay_registry_mutation_decision_gate_hash_bound": true,
    "qwen_replay_cobalt_submission_decision_gate_hash_bound": true,
    "qwen_replay_governance_queue_decision_gate_hash_bound": true,
    "qwen_replay_governance_queue_gate_hash_bound": true,
    "qwen_replay_release_decision_gate_hash_bound": true,
    "qwen_replay_operator_review_gate_hash_bound": true,
    "qwen_replay_release_candidate_gate_hash_bound": true,
    "qwen_replay_promotion_decision_hash_bound": true,
    "qwen_replay_output_validation_receipt_hash_bound": true,
    "qwen_replay_output_manifest_hash_bound": true,
    "qwen_replay_authorization_hash_bound": true,
    "qwen_replay_preflight_hash_bound": true,
    "qwen_prompt_redaction_audit_hash_bound": true,
    "qwen_prompt_input_manifest_hash_bound": true,
    "qwen_public_summary_projection_hash_bound": true,
    "model_request_hash_bound": true,
    "packet_schema_hash_bound": true,
    "field_registry_hash_bound": true,
    "collection_window_bound": true,
    "foundation_exit_criteria_not_defined": true,
    "foundation_exit_criteria_document_not_authored": true,
    "foundation_exit_criteria_authorization_not_requested": true,
    "foundation_exit_criteria_authorization_not_complete": true,
    "criteria_item_count_zero": true,
    "no_criteria_document_hash": true,
    "no_criteria_authorization_hash": true,
    "no_authoring_scope": true,
    "no_authoring_principal": true,
    "no_authorized_review_path": true,
    "no_authorized_cobalt_ratification_path": true,
    "foundation_authority_retained": true,
    "authority_transfer_not_authorized": true,
    "required_future_inputs_bound": true,
    "provider_spend_executed": false,
    "live_model_request_executed": false,
    "model_output_generated": false,
    "live_registry_mutation": false,
    "cobalt_amendment_submitted": false,
    "foundation_exit_criteria_authorization_granted": false,
    "foundation_exit_criteria_document_accepted": false,
    "foundation_exit_criteria_satisfied": false,
    "sidecar_activation": false,
    "commit_reveal_activation": false,
    "validator_enforced_scoring": false,
    "tp1_admission": false,
    "authority_transfer": false
  }
}
